{
  "$schema": "https://json-schema.org/draft/2020-12/schema",
  "$id": "https://repo.webosbrew.org/schemas/api/PackageManifest.schema",
  "title": "PackageManifest",
  "description": "Package manifest for webOS homebrew package",
  "type": "object",
  "properties": {
    "id": {
      "type": "string",
      "description": "Application ID, e.g., \"com.newco.app.myApp\". Every application has a unique ID created using the reverse-DNS naming convention."
    },
    "version": {
      "type": "string",
      "description": "The application version number in dot-decimal format with three components, e.g., 3.0.2500."
    },
    "type": {
      "type": "string",
      "enum": [
        "web",
        "stub",
        "native",
        "native_builtin",
        "native_appshell",
        "qml"
      ],
      "description": "Identifies the application type. These are the same types used in appinfo.json on webOS."
    },
    "title": {
      "type": "string",
      "description": "The title of the application."
    },
    "appDescription": {
      "type": "string",
      "description": "The description of the application shown in the application details page."
    },
    "iconUri": {
      "type": "string",
      "description": "Image displayed for the app. This is a URL to an image, or data: encoded URI."
    },
    "sourceUrl": {
      "type": "string",
      "description": "Link to source code repository or project homepage, etc."
    },
    "rootRequired": {
      "type": [
        "boolean",
        "string"
      ],
      "enum": [
        true,
        false,
        "optional"
      ],
      "description": "Whether this app requires a rooted/jailbroken TV to work or can optionally use root."
    },
    "ipkUrl": {
      "type": "string",
      "description": "URL to package file."
    },
    "ipkHash": {
      "type": "object",
      "properties": {
        "sha256": {
          "type": "string",
          "description": "Hex encoded SHA-256 hash."
        }
      },
      "minProperties": 1,
      "additionalProperties": false,
      "description": "Hash of package file."
    },
    "ipkSize": {
      "type": "integer",
      "exclusiveMinimum": 0,
      "description": "Size of package file in bytes."
    },
    "installedSize": {
      "type": "integer",
      "exclusiveMinimum": 0,
      "description": "Size of installed package in bytes."
    }
  },
  "required": [
    "id",
    "version",
    "type",
    "title",
    "iconUri",
    "ipkUrl",
    "ipkHash"
  ]
}
