{
  "id": "youtube.leanback.v4",
  "version": "1.2.0",
  "type": "native",
  "title": "YouTube Cobalt AdFree",
  "iconUri": "https://raw.githubusercontent.com/RF1705/youtube-webos-cobalt-adfree/main/assets/largeIcon.png",
  "sourceUrl": "https://github.com/RF1705/youtube-webos-cobalt-adfree",
  "rootRequired": false,
  "ipkUrl": "https://github.com/RF1705/youtube-webos-cobalt-adfree/releases/download/v1.2.0/youtube.leanback.v4_1.2.0_arm.ipk",
  "ipkHash": {
    "sha256": "af86a5d2683a99b038927b61b227274c74112b613bd36a41c70732d233d954c1"
  },
  "ipkSize": 19722754
}
