{
  "id": "com.cathwyler.magicremoteservice",
  "title": "MagicRemoteService",
  "version": "1.3.10",
  "type": "web",
  "appDescription": "Use your LG Magic Remote as a Windows mouse and control your PC from your LG webOS TV",
  "iconUri": "https://raw.githubusercontent.com/KTheMan/MagicRemoteService-HBC/v1.3.10/MagicRemoteService/Resources/TV/MagicRemoteService/largeIcon.png",
  "sourceUrl": "https://github.com/Cathwyler/MagicRemoteService",
  "rootRequired": false,
  "ipkUrl": "https://github.com/KTheMan/MagicRemoteService-HBC/releases/download/v1.3.10/com.cathwyler.magicremoteservice_all.ipk",
  "ipkHash": {
    "sha256": "53d5526e557b02e4d9ed210b31c96aa095a319560916278e57cf37beeac79311"
  },
  "ipkSize": 114986
}
