{
  "id": "com.bigbookshelf.tv",
  "title": "Bigbookshelf",
  "version": "v0.14.3",
  "type": "web",
  "appDescription": "Audiobookshelf client for Smart TVs",
  "iconUri": "https://raw.githubusercontent.com/KTheMan/bigbookshelf/v0.14.3/assets/largeIcon.png",
  "sourceUrl": "https://github.com/KTheMan/bigbookshelf",
  "rootRequired": false,
  "ipkUrl": "https://github.com/KTheMan/bigbookshelf/releases/download/v0.14.3/bigbookshelf-webos.ipk",
  "ipkHash": {
    "sha256": "b4f7e79e49a3701bdc02d8141d8a89804561ef1d4ce0277b7ba0568c3c0a3d09"
  },
  "ipkSize": 3411742
}
